id,sb_id,name,display_name,display_order,description,display_help,comment,instrument,min_value,max_value,step_value,min_threshold,max_threshold,stature,sex,created_by,updated_by,created_at,updated_at,deleted_at,help_url
156,33,Fib_04,Fib_04 Minimum Diameter of the Diaphysis,4,The minimum distance at any point along the diaphysis.,"The minimum distance at any point along the diaphysis (Byrd and Adams 2015, #76B).","",sliding calipers,1,99,0.01,6,12,false,false,System,System,2018-04-29 18:35:14,2019-12-27 05:09:02,,https://cora-docs.readthedocs.io/en/latest/forensics-anthro-guide/measurements/#fibula
157,33,Fib_05,Fib_05 Maximum Breadth at the Distal End,5,Place one jaw of the caliper on the posterior portion (tubercle) and extend the other jaw to the opposite side (just above the malleolar articular surface) to find the maximum distance.,"Place one jaw of the caliper on the posterior portion (tubercle) and extend the other jaw to the opposite side (just above the malleolar articular surface) to find the maximum distance (Byrd and Adams 2015, #76C).","",sliding calipers.,10,99,0.01,21,33,false,false,System,System,2018-04-29 18:35:14,2019-12-27 05:09:02,,https://cora-docs.readthedocs.io/en/latest/forensics-anthro-guide/measurements/#fibula
173,34,Cf1_01,Cf1_01 Maximum Length of the 1st Cuneiform,1,This is the maximum length of the bone.  The measurement should be taken with sliding calipers.,"This is the maximum length of the bone.  The measurement should be taken with sliding calipers (Byrd and Adams 2015, #80H).","Move the bone up, down, and sideways in order to obtain the maximum distance, in the same manner that maximum length is obtained for the humerus, femur, etc.",sliding caliper.,10,99,0.01,34,50,false,false,System,System,2018-04-29 18:35:14,2019-12-27 05:09:02,,https://cora-docs.readthedocs.io/en/latest/forensics-anthro-guide/measurements/#feet
95,36,Ham_01,Ham_01 Maximum Length of the Hamate,1,This is the maximum length of the bone.  The measurement should be taken with sliding calipers.,"This is the maximum length of the bone.  The measurement should be taken with sliding calipers (Byrd and Adams 2015, #52.5M).","Move the bone up, down, and sideways in order to obtain the maximum distance.",sliding calipers. ,10,99,0.01,24,33,false,false,System,System,2018-04-29 18:35:14,2019-12-27 05:09:02,,https://cora-docs.readthedocs.io/en/latest/forensics-anthro-guide/measurements/#hands
53,37,Hum_01,Hum_01 Maximum Length,1,Direct distance from the most superior point on the head of the humerus to the most inferior point of the trochlea.,"Direct distance from the most superior point on the head of the humerus to the most inferior point of the trochlea (Hrdlicka 1920:126; Moore-Jansen et al. 1994, #40; Langley et al. 2016:74, #45).","Place the humerus on the osteometric board so that its long axis parallels theinstrument. Place the head of the humerus against the vertical end board and press the movable upright against the trochlea. Move the bone up, down and sideways to determine the maximum distance.",osteometric board.,100,550,0.01,266,392,true,false,System,System,2018-04-29 18:35:14,2019-12-27 05:09:02,,https://cora-docs.readthedocs.io/en/latest/forensics-anthro-guide/measurements/#humerus
54,37,Hum_02,Hum_02 Epicondylar Breadth,2,Distance of the most laterally protruding point on the lateral epicondyle from the corresponding project of the medial epicondyle.,"Distance of the most laterally protruding point on the lateral epicondyle from the corresponding project of the medial epicondyle  (Martin and Knussmann 1988:199, #4; Moore-Jansen et al. 1994, #41; Langley et al. 2016:74, #46).","",osteometric board or sliding calipers.,10,150,0.01,39,81,false,false,System,System,2018-04-29 18:35:14,2019-12-27 05:09:02,,https://cora-docs.readthedocs.io/en/latest/forensics-anthro-guide/measurements/#humerus
55,37,Hum_03,Hum_03 Vertical Diameter of Head,3,Direct distance between the most superior and inferior points on the border of the articular surface.,"Direct distance between the most superior and inferior points on the border of the articular surface (Martin and Knussmann 1988:200, #10; Moore-Jansen et al. 1994, #42; Langley et al. 2016:74, #47).",Do not include arthritic lipping which may be present on the perimeter of the joint surface. This diameter is not necessarily the maximum head diameter.,sliding caliper.,10,99,0.01,34,58,false,true,System,System,2018-04-29 18:35:14,2019-12-27 05:09:02,,https://cora-docs.readthedocs.io/en/latest/forensics-anthro-guide/measurements/#humerus
56,37,Hum_04,Hum_04 Maximum Diameter at Midshaft,4,"Maximum diameter at midshaft (Martin and Knussmann 1988:199, #5; Moore-Jansen et al. 1994, #43; Langley et al. 2016:74-75, #48).",Maximum diameter at midshaft.,"Determine the midpoint of the diaphysis on the osteometric board and mark with a pencil. Using sliding calipers to measure with one hand, rotate the bone with the other hand until the maximum diameter is obtained.",sliding caliper.,1,99,0.01,16,28,false,false,System,System,2018-04-29 18:35:14,2019-12-27 05:09:02,,https://cora-docs.readthedocs.io/en/latest/forensics-anthro-guide/measurements/#humerus
57,37,Hum_05,Hum_05 Minimum Diameter at Midshaft,5,Minimum diameter of midshaft.,"Minimum diameter of midshaft (Martin and Knussmann 1988:199, #6; Moore-Jansen et al. 1994, #44; Langley et al. 2016:75, #49).","Determine the midpoint of the diaphysis on the osteometric board and mark with a pencil. Using sliding calipers to measure with one hand, rotate the bone with the other hand until the minimum diameter is obtained.",sliding caliper.,1,99,0.01,12,24,false,false,System,System,2018-04-29 18:35:14,2019-12-27 05:09:02,,https://cora-docs.readthedocs.io/en/latest/forensics-anthro-guide/measurements/#humerus
58,37,Hum_06,Hum_06 Total Breadth of the Capitulum-Trochlea,6,"The breadth of the capitulum and trochlea at the distal humerus.  One end of the sliding calipers is positioned parallel to the flat, spool-shaped surface of the trochlea (medial), and the other end is moved until it comes into contact with the capitulum (lateral).","The breadth of the capitulum and trochlea at the distal humerus.  One end of the sliding calipers is positioned parallel to the flat, spool-shaped surface of the trochlea (medial), and the other end is moved until it comes into contact with the capitulum (lateral) (Byrd and Adams 2003, #41A).","",sliding caliper.,10,99,0.01,40,52,false,false,System,System,2018-04-29 18:35:14,2019-12-27 05:09:02,,https://cora-docs.readthedocs.io/en/latest/forensics-anthro-guide/measurements/#humerus
59,37,Hum_07,Hum_07 Anterior-Posterior Breadth of the Head,7,The maximum breadth of the humeral head taken in the anterior-posterior direction on the articular surface.  This measurement is taken perpendicular from the vertical diameter of the humeral head (42).,"The maximum breadth of the humeral head taken in the anterior-posterior direction on the articular surface.  This measurement is taken perpendicular from the vertical diameter of the humeral head (42) (Byrd and Adams 2003, #42A).","",sliding caliper.,10,99,0.01,38,50,false,false,System,System,2018-04-29 18:35:14,2019-12-27 05:09:02,,https://cora-docs.readthedocs.io/en/latest/forensics-anthro-guide/measurements/#humerus
60,37,Hum_08,Hum_08 Minimum Diameter of the Diaphysis,8,"The minimum diameter of the humeral diaphysis taken in any direction perpendicular to the shaft.  This measurement should be taken on the oval part of the shaft, superior to the flattening observed around the olecranon fossa and the lateral supracondylar ridge.  Often it is found near midshaft.","The minimum diameter of the humeral diaphysis taken in any direction perpendicular to the shaft.  This measurement should be taken on the oval part of the shaft, superior to the flattening observed around the olecranon fossa and the lateral supracondylar ridge.  Often it is found near midshaft (Byrd and Adams 2003, #44B).","",sliding caliper.,1,99,0.01,16,22,false,false,System,System,2018-04-29 18:35:14,2019-12-27 05:09:02,,https://cora-docs.readthedocs.io/en/latest/forensics-anthro-guide/measurements/#humerus
61,37,Hum_09,Hum_09 Maximum Diameter of Diaphysis at the Deltoid Tuberosity,9,The maximum diameter of the diaphysis within the length of the deltoid tuberosity. Rotate and slide the element to find the maximum diameter.,"The maximum diameter of the diaphysis within the length of the deltoid tuberosity. Rotate and slide the element to find the maximum diameter (Byrd and Adams 2003, #44D).","",sliding caliper,1,99,0.01,18,30,false,false,System,System,2018-04-29 18:35:14,2019-12-27 05:09:02,,https://cora-docs.readthedocs.io/en/latest/forensics-anthro-guide/measurements/#humerus
89,59,Lun_01,Lun_01 Maximum Length of the Lunate,1,This is the maximum length of the bone.  The measurement should be taken with sliding calipers.,"This is the maximum length of the bone. The measurement should be taken with sliding calipers (Byrd and Adams 2015, #52.5G).","Move the bone up, down, and sideways in order to obtain the maximum distance.",sliding calipers.,1,99,0.01,18,25,false,false,System,System,2018-04-29 18:35:14,2019-12-27 05:09:02,,https://cora-docs.readthedocs.io/en/latest/forensics-anthro-guide/measurements/#hands
29,61,Man_01,Man_01 Chin Height (id-gn),1,Direct distance from infradentale (id) to gnathion (gn).,"Direct distance from infradentale (id) to gnathion (gn) (Martin and Knussmann 1988:183, #69; Moore-Jansen et al. 1994, #25; Langley et al. 2016:71, #29).","When the mandibular alveolar process is damaged between the central incisors, estimates of this measurement are recorded by using the intact alveolar process at the position of the lateral incisors. Any estimate or adjustment should be indicated on the recording form. In mandibles where the alveolar process exhibit pronounced erosion or resorption, this measurement is not taken.",sliding caliper.,10,99,0.01,21,45,false,false,System,System,2018-04-29 18:35:14,2019-12-27 05:09:02,,https://cora-docs.readthedocs.io/en/latest/forensics-anthro-guide/measurements/#mandible
191,61,Man_02L,Man_02L Height of the Left Mandibular Body,2,Direct distance from the alveolar process to the inferior border of the mandible perpendicular to the base at the level of the mental foramen.,"Direct distance from the alveolar process to the inferior border of the mandible perpendicular to the base at the level of the mental foramen (Martin and Knussmann 1988:183, #69.1; Moore-Jansen et al. 1994, #26; Langley et al. 2016:71, #30).","",sliding caliper.,1,99,0.01,18,42,false,false,System,System,2018-12-08 16:50:26,2019-12-27 05:09:02,,https://cora-docs.readthedocs.io/en/latest/forensics-anthro-guide/measurements/#mandible
192,61,Man_02R,Man_02R Height of the Right Mandibular Body,3,Direct distance from the alveolar process to the inferior border of the mandible perpendicular to the base at the level of the mental foramen.,"Direct distance from the alveolar process to the inferior border of the mandible perpendicular to the base at the level of the mental foramen (Martin and Knussmann 1988:183, #69.1; Moore-Jansen et al. 1994, #26; Langley et al. 2016:71, #30).","",sliding caliper.,1,99,0.01,18,42,false,false,System,System,2018-12-08 16:50:26,2019-12-27 05:09:02,,https://cora-docs.readthedocs.io/en/latest/forensics-anthro-guide/measurements/#mandible
193,61,Man_03L,Man_03L Breadth of the Left Mandibular Body,4,Maximum breadth measured in the region of the mental foramen perpendicular to the long axis of the mandibular body.,"Maximum breadth measured in the region of the mental foramen perpendicular to the long axis of the mandibular body (Martin and Knussmann 1988:183, #69.3; Moore-Jansen et al. 1994, #27; Langley et al. 2016:71, #31).","",sliding caliper.,1,99,0.01,6,18,false,false,System,System,2018-12-08 16:50:26,2019-12-27 05:09:02,,https://cora-docs.readthedocs.io/en/latest/forensics-anthro-guide/measurements/#mandible
194,61,Man_03R,Man_03R Breadth of the Right Mandibular Body,5,Maximum breadth measured in the region of the mental foramen perpendicular to the long axis of the mandibular body.,"Maximum breadth measured in the region of the mental foramen perpendicular to the long axis of the mandibular body (Martin and Knussmann 1988:183, #69.3; Moore-Jansen et al. 1994, #27; Langley et al. 2016:71, #31).","",sliding caliper.,1,99,0.01,6,18,false,false,System,System,2018-12-08 16:50:26,2019-12-27 05:09:02,,https://cora-docs.readthedocs.io/en/latest/forensics-anthro-guide/measurements/#mandible
32,61,Man_04,Man_04 Bigonial Breadth (go-go),6,"Direct distance between right and left gonion (go)  (Martin and Knussmann 1988:182, #66; Moore-Jansen et al. 1994, #28; Langley et al. 2016:71, #32).",Direct distance between right and left gonion (go).,Apply the blunt points of the caliper arms to the most prominent external points at the mandibular angles.,sliding caliper.,10,200,0.01,74,116,false,false,System,System,2018-04-29 18:35:14,2019-12-27 05:09:02,,https://cora-docs.readthedocs.io/en/latest/forensics-anthro-guide/measurements/#mandible
33,61,Man_05,Man_05 Bicondylar Breadth (cdl-cdl),7,Direct distance between the most lateral points of the two condyles (cdl) .,"Direct distance between the most lateral points of the two condyles (cdl)  (Martin and Knussmann 1988:182, #65; Moore-Jansen et al. 1994, #29; Langley et al. 2016:71, #33).",Place the blunt point of the fixed end of the instrument against the right condyle and apply the movable end to the left condyle.,sliding caliper.,10,250,0.01,95,137,false,false,System,System,2018-04-29 18:35:14,2019-12-27 05:09:02,,https://cora-docs.readthedocs.io/en/latest/forensics-anthro-guide/measurements/#mandible
195,61,Man_06L,Man_06L Minimum Left Ramus Breadth,8,Least breadth of the mandibular ramus measured perpendicular to the height of the ramus.,"Least breadth of the mandibular ramus measured perpendicular to the height of the ramus (Martin and Knussmann 1988:183, #71a; Moore-Jansen et al. 1994, #30; Langley et al. 2016:72, #34).",The measurement is taken at the waist of the ramus (the point where the distance between the anterior and posterior margins of the ramus is the smallest).,sliding caliper.,10,99,0.01,19,43,false,false,System,System,2018-12-08 16:50:26,2019-12-27 05:09:02,,https://cora-docs.readthedocs.io/en/latest/forensics-anthro-guide/measurements/#mandible
196,61,Man_06R,Man_06R Minimum Right Ramus Breadth,9,Least breadth of the mandibular ramus measured perpendicular to the height of the ramus.,"Least breadth of the mandibular ramus measured perpendicular to the height of the ramus (Martin and Knussmann 1988:183, #71a; Moore-Jansen et al. 1994, #30; Langley et al. 2016:72, #34).",The measurement is taken at the waist of the ramus (the point where the distance between the anterior and posterior margins of the ramus is the smallest).,sliding caliper.,10,99,0.01,19,43,false,false,System,System,2018-12-08 16:50:26,2019-12-27 05:09:02,,https://cora-docs.readthedocs.io/en/latest/forensics-anthro-guide/measurements/#mandible
197,61,Man_07L,Man_07L Maximum Left Ramus Breadth,10,Distance between the most anterior point on the mandibular ramus and a line connecting the most posterior point on the condyle and the angle of the jaw.,"Distance between the most anterior point on the mandibular ramus and a line connecting the most posterior point on the condyle and the angle of the jaw (Moore-Jansen et al. 1994, #31).","",sliding caliper.,10,99,0.01,29,53,false,false,System,System,2018-12-08 16:50:26,2019-12-27 05:09:02,,https://cora-docs.readthedocs.io/en/latest/forensics-anthro-guide/measurements/#mandible
198,61,Man_07R,Man_07R Maximum Right Ramus Breadth,11,Distance between the most anterior point on the mandibular ramus and a line connecting the most posterior point on the condyle and the angle of the jaw.,"Distance between the most anterior point on the mandibular ramus and a line connecting the most posterior point on the condyle and the angle of the jaw (Moore-Jansen et al. 1994, #31).","",sliding caliper.,10,99,0.01,29,53,false,false,System,System,2018-12-08 16:50:26,2019-12-27 05:09:02,,https://cora-docs.readthedocs.io/en/latest/forensics-anthro-guide/measurements/#mandible
36,61,Man_08,Man_08 Maximum Ramus Height,12,Direct distance from the highest point on the mandibular condyle to gonion (go).,"Direct distance from the highest point on the mandibular condyle to gonion (go) (Martin and Knussmann 1988:183, #70; Moore-Jansen et al. 1994, #32; Langley et al. 2016:72, #35).",Apply movable board of the mandibulometer to the posterior borders of the mandibular rami and the fixed board against the most anterior point of the chin.,mandibulometer.,10,150,0.01,39,81,false,false,System,System,2018-04-29 18:35:14,2019-12-27 05:09:02,,https://cora-docs.readthedocs.io/en/latest/forensics-anthro-guide/measurements/#mandible
37,61,Man_09,Man_09 Mandibular Length,13,Distance of the anterior margin of the chin from a center point on the projected straight line placed along the posterior border of the two mandibular angles.,"Distance of the anterior margin of the chin from a center point on the projected straight line placed along the posterior border of the two mandibular angle (Martin and Knussmann 1988:185, #79; Moore-Jansen et al. 1994, #34; Langley et al. 2016:72, #37).","In case of rocker jaws, the bone is held in place by pressing down on the second molars.",mandibulometer.,10,150,0.01,56,98,false,false,System,System,2018-04-29 18:35:14,2019-12-27 05:09:02,,https://cora-docs.readthedocs.io/en/latest/forensics-anthro-guide/measurements/#mandible
38,61,Man_10,Man_10 Mandibular Angle,14,Angle formed by the inferior border of the corpus and the posterior border of the ramus.,"Angle formed by the inferior border of the corpus and the posterior border of the ramus (Martin and Knussmann 1988:185, #79; Moore-Jansen et al. 1994, #34; Langley et al. 2016:72, #37).","In case of rocker jaw, the bone is held in place by pressing down on the second molars.",mandibulometer.,50,300,0.01,104,146,false,false,System,System,2018-04-29 18:35:14,2019-12-27 05:09:02,,https://cora-docs.readthedocs.io/en/latest/forensics-anthro-guide/measurements/#mandible
83,64,MC1_01,MC1_01 Maximum Length of the 1st Metacarpal,1,This is the maximum length of the bone.  The measurement should be taken with sliding calipers.,"This is the maximum length of the bone.  The measurement should be taken with sliding calipers. (Byrd and Adams 2015, #52.5A)","Move the bone up, down, and sideways in order to obtain the maximum distance.",sliding calipers. ,10,99,0.01,42,55,false,false,System,System,2018-04-29 18:35:14,2019-12-27 05:09:02,,https://cora-docs.readthedocs.io/en/latest/forensics-anthro-guide/measurements/#hands
84,65,MC2_01,MC2_01 Maximum Length of the 2nd Metacarpal,2,This is the maximum length of the bone.  The measurement should be taken with sliding calipers.,"This is the maximum length of the bone.  The measurement should be taken with sliding calipers.  (Byrd and Adams 2015, #52.5B).","Move the bone up, down, and sideways in order to obtain the maximum distance.",sliding calipers. ,10,150,0.01,59,85,false,false,System,System,2018-04-29 18:35:14,2019-12-27 05:09:02,,https://cora-docs.readthedocs.io/en/latest/forensics-anthro-guide/measurements/#hands
85,66,MC3_01,MC3_01 Maximum Length of the 3rd Metacarpal,3,This is the maximum length of the bone.  The measurement should be taken with sliding calipers.,"This is the maximum length of the bone.  The measurement should be taken with sliding calipers.   (Byrd and Adams 2015, #52.5C).","Move the bone up, down, and sideways in order to obtain the maximum distance.",sliding calipers.,10,150,0.01,62,82,false,false,System,System,2018-04-29 18:35:14,2019-12-27 05:09:02,,https://cora-docs.readthedocs.io/en/latest/forensics-anthro-guide/measurements/#hands
86,67,MC4_01,MC4_01 Maximum Length of the 4th Metacarpal,4,This is the maximum length of the bone.  The measurement should be taken with sliding calipers.,"This is the maximum length of the bone.  The measurement should be taken with sliding calipers.   (Byrd and Adams 2015, #52.5D).","Move the bone up, down, and sideways in order to obtain the maximum distance.",sliding calipers.,10,150,0.01,53,71,false,false,System,System,2018-04-29 18:35:14,2019-12-27 05:09:02,,https://cora-docs.readthedocs.io/en/latest/forensics-anthro-guide/measurements/#hands
87,68,MC5_01,MC5_01 Maximum Length of the 5th Metacarpal,5,This is the maximum length of the bone.  The measurement should be taken with sliding calipers.,"This is the maximum length of the bone.  The measurement should be taken with sliding calipers.  (Byrd and Adams 2015, #52.5E). ","Move the bone up, down, and sideways in order to obtain the maximum distance.",sliding calipers. ,10,150,0.01,49,65,false,false,System,System,2018-04-29 18:35:14,2019-12-27 05:09:02,,https://cora-docs.readthedocs.io/en/latest/forensics-anthro-guide/measurements/#hands
166,69,MT1_01,MT1_01 Maximum Length of the 1st Metatarsal,1,"This is the maximum length of the bone.  The measurement may be taken with an osteometric board or sliding calipers.  Move the bone up, down, and sideways in order to obtain the maximum distance, in the same manner that maximum length is obtained for the humerus, femur, etc.","This is the maximum length of the bone.  The measurement may be taken with an osteometric board or sliding calipers.  (Byrd and Adams 2015, #80A).","Move the bone up, down, and sideways in order to obtain the maximum distance, in the same manner that maximum length is obtained for the humerus, femur, etc.",sliding caliper.,10,150,0.01,57,80,false,false,System,System,2018-04-29 18:35:14,2019-12-27 05:09:02,,https://cora-docs.readthedocs.io/en/latest/forensics-anthro-guide/measurements/#feet
167,70,MT2_01,MT2_01 Maximum Length of the 2nd Metatarsal,2,This is the maximum length of the bone.  The measurement may be taken with an osteometric board or sliding calipers.,"This is the maximum length of the bone.  The measurement may be taken with an osteometric board or sliding calipers.  (Byrd and Adams 2015, #80B)","Move the bone up, down, and sideways in order to obtain the maximum distance, in the same manner that maximum length is obtained for the humerus, femur, etc.",sliding caliper.,10,150,0.01,66,94,false,false,System,System,2018-04-29 18:35:14,2019-12-27 05:09:02,,https://cora-docs.readthedocs.io/en/latest/forensics-anthro-guide/measurements/#feet
168,71,MT3_01,MT3_01 Maximum Length of the 3rd Metatarsal,3,This is the maximum length of the bone.  The measurement may be taken with an osteometric board or sliding calipers.,"This is the maximum length of the bone.  The measurement may be taken with an osteometric board or sliding calipers.  (Byrd and Adams 2015, #80C)","Move the bone up, down, and sideways in order to obtain the maximum distance, in the same manner that maximum length is obtained for the humerus, femur, etc.",sliding caliper.,10,150,0.01,61,87,false,false,System,System,2018-04-29 18:35:14,2019-12-27 05:09:02,,https://cora-docs.readthedocs.io/en/latest/forensics-anthro-guide/measurements/#feet
169,72,MT4_01,MT4_01 Maximum Length of the 4th Metatarsal,4,This is the maximum length of the bone.  The measurement may be taken with an osteometric board or sliding calipers.,"This is the maximum length of the bone.  The measurement may be taken with an osteometric board or sliding calipers.  (Byrd and Adams 2015, #80D)","Move the bone up, down, and sideways in order to obtain the maximum distance, in the same manner that maximum length is obtained for the humerus, femur, etc.",sliding caliper.,10,150,0.01,60,84,false,false,System,System,2018-04-29 18:35:14,2019-12-27 05:09:02,,https://cora-docs.readthedocs.io/en/latest/forensics-anthro-guide/measurements/#feet
170,73,MT5_01,MT5_01 Maximum Length of the 5th Metatarsal,5,This is the maximum length of the bone.  The measurement may be taken with an osteometric board or sliding calipers.,"This is the maximum length of the bone.  The measurement may be taken with an osteometric board or sliding calipers.  (Byrd and Adams 2015, #80E)","Move the bone up, down, and sideways in order to obtain the maximum distance, in the same manner that maximum length is obtained for the humerus, femur, etc.",sliding caliper.,10,150,0.01,60,88,false,false,System,System,2018-04-29 18:35:14,2019-12-27 05:09:02,,https://cora-docs.readthedocs.io/en/latest/forensics-anthro-guide/measurements/#feet
172,75,Nav_01,Nav_01 Maximum Length of the Navicular,1,This is the maximum length of the bone.  The measurement should be taken with sliding calipers.,"This is the maximum length of the bone.  The measurement should be taken with sliding calipers.   (Byrd and Adams 2015, #80G)","Move the bone up, down, and sideways in order to obtain the maximum distance, in the same manner that maximum length is obtained for the humerus, femur, etc.",sliding caliper.,10,99,0.01,33,52,false,false,System,System,2018-04-29 18:35:14,2019-12-27 05:09:02,,https://cora-docs.readthedocs.io/en/latest/forensics-anthro-guide/measurements/#feet
101,77,Osc_01,Osc_01 Maximum Innominate Height,1,Distance from the most superior point on the iliac crest to the most inferior point on the ischial tuberosity.,"Distance from the most superior point on the iliac crest to the most inferior point on the ischial tuberosity (Hrdlicka 1920:135; Martin and Knussmann 1988:213, #1; Moore-Jansen et al. 1994, #56; Langley et al. 2016:77, #64).","When using an osteometric board, place the ischium against the vertical end board and press the movable upright against the iliac crest. Move the ilium sideways and up and down to obtain the maximum distance.",osteometric board or spreading caliper.,100,400,0.01,168,258,false,false,System,System,2018-04-29 18:35:14,2019-12-27 05:09:02,,https://cora-docs.readthedocs.io/en/latest/forensics-anthro-guide/measurements/#os-coxa
